name	exactAddress	ambiance	signatureMenu	menuFeatures	positiveReviews	negativeReview	reviewLinks	waitingSystem	hasPlugs	parkingInfo	hasDecaf	isLargeCafe	isPetFriendly	comparisons	latitude	longitude
초이베이크샵	경기 오산시 오산로 183-4	오산. 블랙 앤 화이트 톤의 깔끔한 단독주택 개조 디저트 샵	메론크림 소금빵, 바스크 치즈케이크	촉촉한 바스크 치즈케이크와 독특한 메론크림 소금빵이 있는 감성 공간	단독주택을 개조한 모던한 인테리어가 예뻐서 어디서 찍어도 감성 사진이 나옵니다|메론크림 소금빵은 여기서만 먹어본 독특한 맛인데 진짜 맛있어요|마당에 무료 주차가 가능해서 차 끌고 가기 너무 편합니다	화장실이 남녀 공용이 아니지만 계단 등 단독주택 특성상 공간이 협소할 수 있습니다.	https://blog.naver.com/boya54|https://blog.naver.com/rainbow_bbi|https://blog.naver.com/yeahtree_	포장 손님 위주	False	주차 가능 (공영/유료 주차장 등 확인 필요)	False	False	False	레이어드|디저트 카페|안국 레이어드가 빈티지 스콘 맛집이라면, 초이베이크샵은 모던한 블랙앤화이트 감성의 소금빵/치즈케이크 맛집	37.143397	127.0680055
러프러프 아뜰리에 안국	서울 종로구 북촌로4길 19	안국 북촌. 천장 레일 위로 케이크가 돌아가는 유럽풍 아뜰리에 카페	치즈케이크(딸기/말차 등)	유럽의 작업실 같은 공간에서 즐기는 꾸덕하고 깊은 풍미의 치즈케이크	천장에 케이크 박스가 돌아가는 인테리어가 진짜 독특하고 힙해요|치즈케이크가 종류별로 다 꾸덕하고 맛있어서 도장 깨기 하고 싶습니다|한쪽 벽면 스크린 덕분에 영화 속에 들어온 것 같은 아늑한 감성이 최고예요	전용 주차장이 없고 주말에는 사람이 많아 매우 혼잡합니다.	https://blog.naver.com/yoon_tto|https://blog.naver.com/rim_life_|https://blog.naver.com/solace_for/224289028755	주말 현장 웨이팅	False	주차 불가 (대중교통 권장)	False	False	False	하이웨스트|감성 디저트|카페 하이웨스트가 아기자기한 빈티지 홈메이드 감성이라면, 러프러프는 힙하고 예술적인 아뜰리에 감성	37.5793976	126.9861826
도토리가든 안국점	서울 종로구 계동길 19-8	안국 북촌. 지브리 애니메이션 속에 들어온 듯한 동화 같은 마당 카페	도토리 마들렌, 벌집 그릭요거트	귀여운 도토리 마들렌과 즉석에서 벌집 꿀을 올려주는 꾸덕한 그릭요거트	진짜 지브리 스튜디오에 들어온 것처럼 공간 구석구석이 다 포토존이에요|그릭요거트에 벌집 꿀을 얹어주는데 비주얼도 좋고 맛도 훌륭합니다|마들렌 모양이 너무 귀엽고 겉바속촉이라 선물용으로도 여러 개 샀어요	웨이팅이 너무 길어 주말에는 1시간 이상 기다려야 하며 내부가 다소 복잡합니다.	https://blog.naver.com/jangyj101|https://blog.naver.com/97duswl|https://blog.naver.com/sksk1995kr/224301134175	캐치테이블/현장 웨이팅 긺	False	주차 정보 없음	False	False	False	런던베이글뮤지엄|북촌 핫플|런베뮤가 런던의 이국적인 빵집 감성이라면, 도토리가든은 동화 속 숲속의 오두막 같은 지브리 감성	37.5780996	126.9862903
어니언 안국	서울 종로구 계동길 5	안국. 한국의 미를 살린 고즈넉한 대형 한옥 베이커리 카페	팡도르, 인절미빵	전통 한옥의 ㅁ자 구조 안에서 즐기는 다채로운 베이커리와 스페셜티 커피	한옥의 고즈넉한 인테리어가 너무 예뻐서 외국인 친구 데려가기 최고입니다|대표 메뉴인 팡도르가 달콤하고 부드러워서 아메리카노랑 찰떡이에요|툇마루에 앉아 커피 마시는 감성이 서울 한복판에서 느끼기 힘든 힐링입니다	항상 사람이 너무 많고 시끄러워 조용한 한옥의 정취를 느끼기는 어렵습니다.	https://blog.naver.com/ronyandi|https://blog.naver.com/hafrika|https://blog.naver.com/scene279/224236258142	현장 웨이팅 (테이크아웃은 빠름)	False	주차 정보 없음	False	True	False	블루보틀 삼청|안국 카페|블루보틀 삼청이 현대적이고 미니멀한 감성이라면, 어니언 안국은 한국의 전통적인 매력을 극대화한 대형 한옥 카페	37.5774607	126.9865244
정동문화사	대전 동구 창조2길 11	대전역 앞. 오픈런 필수인 대전 최고의 구움과자 빵지순례 코스	에그타르트, 휘낭시에	1인당 구매 제한이 있을 정도로 인기 폭발인 겉바속촉 에그타르트와 까눌레	에그타르트 진짜 인생 타르트입니다 겉은 바삭하고 속은 푸딩 같아요|대전 가면 무조건 들러야 하는 빵지순례 1순위 구움과자 맛집입니다|까눌레랑 휘낭시에도 종류별로 다 맛있어서 기다린 보람이 있어요	웨이팅이 극악이며 오후 늦게 가면 디저트가 다 팔려 살 수가 없습니다.	https://blog.naver.com/girasol301/224263390890|https://blog.naver.com/3349935|https://blog.naver.com/jy992424/224220927118	번호표 수령 후 현장 대기	False	주차 불가 (대중교통 권장)	False	False	False	성심당|대전 빵지순례|성심당이 대전의 상징적인 종합 빵집이라면, 정동문화사는 구움과자와 타르트에 특화된 오픈런 필수 디저트 샵	36.3277079	127.4356228
땡큐베리머치	대전 중구 중교로 49	대전 대흥동. 압도적인 쇼케이스 라인업을 자랑하는 가성비 케이크 맛집	쑥쓰럽구마 케이크, 얼그레이 쇼콜라	다양한 제철 과일과 이색적인 재료 조합으로 눈이 즐거운 수십 가지 조각 케이크	케이크 종류가 너무 많아서 고르는 데만 한참 걸릴 정도로 행복한 고민을 하게 됩니다|쑥쓰럽구마 케이크 등 독특한 조합이 많은데 맛도 기대 이상으로 훌륭해요|가격 대비 크기도 크고 가성비가 좋아서 포장 손님도 엄청 많습니다	지하 공간은 환기가 잘 안 돼서 습하고 꿉꿉한 냄새가 난다는 평이 있습니다.	https://blog.naver.com/jung940419/224255749695|https://blog.naver.com/wishtree_|https://blog.naver.com/jooyeoni/224229412634	현장 웨이팅	False	주차 정보 없음	False	False	False	투썸플레이스|케이크 전문점|투썸플레이스가 친숙한 대중적인 케이크라면, 땡큐베리머치는 수십 가지 독창적인 라인업으로 무장한 로컬 케이크 천국	36.3259071	127.4251564
더힐846	경기 화성시 동탄대로 181	동탄. 라운딩 후 휴식하기 좋은 자연 친화적 전망의 공간	아메리카노	골프장 인근의 쾌적한 시설과 탁 트인 전경 속 여유로운 휴식	자연 속에서 탁 트인 전경을 보며 쉴 수 있어 라운딩 전후로 들르기 좋습니다|주차 공간이 넓고 쾌적해서 단체로 방문하기에 부담이 없어요|음료 맛이 깔끔하고 공간이 넓어서 편안하게 머무를 수 있습니다	일반적인 디저트 카페와 달리 전문적인 베이커리 메뉴나 시그니처가 부족할 수 있습니다.	https://blog.naver.com/jineeeees2/223912590940|https://blog.naver.com/kwonse113/224048852440|https://blog.naver.com/dmswlm5	웨이팅 없음	False	주차 가능 (공영/유료 주차장 등 확인 필요)	False	False	False	일반 대형카페|특징|도심 속 일반 대형카페가 트렌디한 인테리어를 뽐낸다면, 더힐846은 자연 경관과 쾌적함에 집중한 휴식처	37.170251	127.1049818
어서오슈	경기 성남시 수정구 탄리로 22	성남 신흥동. 아기자기한 감성의 부드러운 슈크림 디저트 맛집	슈크림, 조각 케이크	매장에서 직접 굽는 신선한 슈크림과 톡톡 튀는 이름의 스페셜 음료	가게 이름처럼 슈크림이 진짜 부드럽고 달콤해서 스트레스가 확 풀려요|인스타 감성 낭낭한 인테리어라 연인과 조용히 데이트하기 좋습니다|꽃메리카노 등 이름부터 귀여운 음료들이 맛도 깔끔하고 좋아요	매장 규모가 크지 않아 장시간 노트북으로 작업하기에는 눈치가 보일 수 있습니다.	https://blog.naver.com/ember912|https://blog.naver.com/violet_929292|https://blog.naver.com/y-eun667	포장 손님 많음	False	주차 정보 없음	False	False	False	비어드파파|슈크림 전문점|비어드파파가 백화점 지하의 포장형 슈크림 브랜드라면, 어서오슈는 예쁜 감성 공간에서 즐기는 개인 카페 스타일 슈크림	37.4388715	127.1389843
마르케	서울 강남구 강남대로124길 5	강남 논현. 깔끔하고 아늑한 분위기의 구움과자 및 타르트 맛집	에그타르트, 프렌치 버터 스콘	좋은 재료로 만든 퀄리티 높은 에그타르트와 편안하게 머물다 가기 좋은 공간	에그타르트 속이 꽉 차 있고 파이결이 바삭해서 강남권에서 손에 꼽는 맛입니다|매장이 깔끔하고 아늑해서 친구랑 식사 후 수다 떨러 가기 정말 완벽해요|레몬케이크랑 버터 스콘도 버터 풍미가 좋고 퀄리티가 뛰어납니다	전용 주차장이 없어 차량 방문 시 인근 공영주차장을 찾아야 합니다.	https://blog.naver.com/junis2may|https://blog.naver.com/kkokkobook/224183260165|https://blog.naver.com/mywaynanana	웨이팅 거의 없음	False	주차 가능 (공영/유료 주차장 등 확인 필요)	False	False	False	나타오비카|에그타르트|나타오비카가 포르투갈식 타르트 체인점이라면, 마르케는 편안한 카페 감성 속에서 즐기는 수준 높은 수제 타르트	37.5088585	127.0231079
베이커스트 브라운	서울 강남구 강남대로102길 21	강남 신논현. 4층 규모의 쾌적하고 분위기 좋은 대형 베이커리 카페	프렌치파이, 크루아상	지하부터 3층까지 각기 다른 감성으로 꾸며진 쾌적한 빵지순례 핫플	강남역 한복판에 이렇게 넓고 쾌적한 대형 카페가 있다니 놀라워요|프렌치파이 종류가 정말 다양하고 겹겹이 바삭한 식감이 예술입니다|층마다 인테리어 컨셉이 조금씩 달라서 어디에 앉아도 사진이 잘 나옵니다	매장 규모가 크다 보니 다소 시끄럽고 어수선할 수 있습니다.	https://blog.naver.com/the_manura|https://blog.naver.com/hy0rl0/224279830097|https://blog.naver.com/mgseo93/224301987546	웨이팅 거의 없음	False	주차 정보 없음	False	True	False	알베르|강남 대형카페|알베르가 숲속 산장 느낌의 넓은 카페라면, 베이커스트 브라운은 세련된 도심형 대형 베이커리 공간	37.5025035	127.0272434
고페르	경기 화성시 동탄순환대로12길 8	동탄 산척동. 따뜻한 우드톤 인테리어의 아늑한 초코 소금빵 맛집	초코 소금빵, 잠봉뵈르	다양한 라인업의 쫀득한 소금빵과 스콘이 매력적인 감성 카페	우드톤 인테리어와 조용하고 아늑한 분위기가 편안하게 쉴 수 있게 해줍니다|대표 메뉴인 초코 소금빵은 안에 초코가 듬뿍 들어있어 단짠의 정석이에요|직원분들이 친절하고 매장이 깨끗해서 자주 포장하러 갑니다	테이블 수가 많지 않아 오래 머무르기에는 다소 눈치가 보일 수 있습니다.	https://blog.naver.com/cjh831124|https://blog.naver.com/sensaa/223530839074|https://blog.naver.com/polep5959/224135206720	포장 손님 위주	False	주차 정보 없음	False	False	False	아우어베이커리|베이커리 전문점|아우어베이커리가 화려하고 트렌디한 빵집이라면, 고페르는 아늑하고 편안한 분위기의 동네 소금빵 맛집	37.1689423	127.1194036
흐그이므자	대전 중구 보문로 295	대전 선화동. 댕댕이 크림이 올라간 샌드(산도)가 유명한 귀여운 감성 카페	과일 산도(샌드), 이므자티	달지 않고 맛있는 크림과 톡톡 튀는 시그니처 음료를 즐길 수 있는 곳	강아지 모양 크림이 올라간 산도가 너무 귀여워서 먹기 아까울 정도예요|크림이 많이 달지 않고 과일이랑 잘 어울려서 순식간에 다 먹었습니다|시그니처인 이므자티가 상큼하고 청량해서 디저트랑 찰떡궁합이에요	공간 구조상 말소리가 다소 울려 시끄럽게 느껴질 때가 있습니다.	https://blog.naver.com/aewf257/224290201546|https://blog.naver.com/iimorez2/224170266475|https://blog.naver.com/0__0_blog/224294896618	주말 약간 대기	False	주차 정보 없음	False	False	True	오븐브라더스|디저트 카페|오븐브라더스가 클래식한 프랑스식 구움과자 전문이라면, 흐그이므자는 귀엽고 톡톡 튀는 아이디어가 돋보이는 감성 디저트샵	36.3287556	127.42035
버터브루	경기 성남시 중원구 제일로63번길 14	성남 모란역. 따뜻하고 감성적인 조명이 빛나는 구움과자와 소금빵 핫플	소금빵, 에그타르트	기본에 충실한 소금빵부터 쪽파크림치즈까지 다양한 변주가 있는 베이커리	모란역 인근에서 가장 분위기 좋고 편안하게 대화하기 좋은 카페입니다|소금빵 밑바닥이 바삭하게 잘 구워졌고 버터 동굴도 완벽해요|조명이 따뜻해서 데이트 코스로도 손색이 없고 커피 맛도 깔끔합니다	주차 공간이 마땅치 않아 차량 방문보다는 대중교통 이용이 편합니다.	https://blog.naver.com/uhooyahawaha/224293972970|https://blog.naver.com/csm2022/224302410609|https://blog.naver.com/cww0329	웨이팅 거의 없음	False	주차 불가 (대중교통 권장)	False	False	False	소금빵 맛집|디저트 퀄리티|일반 프랜차이즈 빵집이 획일화된 맛이라면, 버터브루는 정성 가득한 수제 구움과자의 풍미가 돋보임	37.4323851	127.1342462
아이스걸크림보이 문정점	서울 송파구 법원로 128	송파 문정동. 유기농 우유와 제철 과일로 만든 쫀득한 수제 젤라또 전문점	수제 젤라또(소르베)	이탈리아 국가공인 젤라띠에레의 레시피로 매일 신선하게 만드는 젤라또	재료 본연의 맛이 찌르지 않고 은은하게 느껴져서 고급스러운 단맛입니다|젤라또 특유의 쫀득함이 살아있고 제철 과일 소르베가 정말 상큼해요|인공적인 색소나 향료 맛이 안 나서 아이들과 함께 먹기에도 안심이 됩니다	매장 취식 공간이 좁은 편이라 대부분 테이크아웃을 이용해야 합니다.	https://blog.naver.com/uplay_98|https://blog.naver.com/yummmmmy-_-/224305702978|https://blog.naver.com/whwjdghk54	웨이팅 없음	False	주차 정보 없음	False	False	False	배스킨라빈스|아이스크림 전문점|배스킨라빈스가 자극적이고 화려한 맛이라면, 아이스걸크림보이는 신선하고 건강한 자연주의 수제 젤라또	37.4869252	127.1199664
웰로우	경기 성남시 중원구 성남대로1140번길 18	성남 모란역. 쫀득하고 고소한 '버터떡'이 일품인 조용하고 차분한 카페	버터떡	시끌벅적한 상권 속에서 오아시스처럼 편안하게 대화하기 좋은 감성 공간	모란역 술집 거리와 달리 조용하고 차분해서 지인과 대화하기 너무 좋습니다|버터떡이라는 메뉴를 처음 먹어봤는데 겉바속쫀에 버터 풍미가 대박이에요|매장 인테리어가 깔끔하고 모던해서 자주 찾게 되는 아지트 같은 곳입니다	매장 간판이 눈에 잘 띄지 않아 처음 방문 시 길을 헤맬 수 있습니다.	https://blog.naver.com/nullxxx153|https://blog.naver.com/aori_blog|https://blog.naver.com/ek5795/224210001622	웨이팅 없음	False	주차 정보 없음	False	False	False	일반 디저트 카페|특징|흔한 케이크 전문점과 달리, 웰로우는 버터떡이라는 독창적이고 맛있는 시그니처 디저트를 제공함	37.4316269	127.1313797
멜리플리	경기 성남시 중원구 성남대로1139번길 10-4	성남 모란역. 깔끔한 분위기와 친절한 서비스로 기억되는 편안한 카페	아인슈페너, 조각 케이크	역 주변에서 잠시 쉬어가거나 가벼운 업무를 보기에 적합한 동네 카페	음료 양이 넉넉하고 커피 향이 좋아서 식후에 방문하기 좋습니다|직원분들이 항상 친절하게 응대해 주셔서 기분 좋게 머물다 갑니다|적당한 백색소음이 있어서 혼자 책 읽거나 다이어리 쓰기에 완벽해요	특별하고 개성 강한 시그니처 디저트 라인업은 조금 부족할 수 있습니다.	https://blog.naver.com/fizz_report/224281805970|https://blog.naver.com/stathaeun|https://blog.naver.com/douchi_diary	웨이팅 없음	True	주차 정보 없음	False	False	False	이디야|동네 카페|이디야가 가성비 위주의 프랜차이즈라면, 멜리플리는 더 조용하고 세심한 관리가 돋보이는 개인 카페	37.4316995	127.1276876
니드스윗	서울 송파구 백제고분로45길 22-1	송파 송리단길. 따뜻한 우드 감성과 매그놀리아 스타일 바나나 푸딩의 만남	바나나 푸딩, 쿠키	아기자기한 소품들과 퀄리티 높은 구움과자가 가득한 아늑한 디저트 샵	바나나 푸딩이 많이 달지 않으면서도 부드러워서 숟가락을 멈출 수가 없어요|외관부터 내부까지 따스한 분위기로 꾸며져 있어 사진 찍기에 정말 좋습니다|휘낭시에랑 쿠키도 겉바속촉 제대로라 포장해 가는 손님이 끊이질 않아요	공간이 협소한 편이라 주말 피크 타임에는 대기가 필수적입니다.	https://blog.naver.com/elwiz|https://blog.naver.com/now0jj|https://blog.naver.com/arean4571	현장 웨이팅	False	주차 정보 없음	False	False	False	카페 노티드|디저트 카페|노티드가 트렌디하고 팝한 도넛 전문점이라면, 니드스윗은 차분하고 따스한 감성의 구움과자/푸딩 맛집	37.5101196	127.1092183
로텐바우	경기 화성시 왕배산1길 19	동탄 목동. 직접 로스팅한 원두와 기본기 탄탄한 베이커리가 있는 동네 찐맛집	코르네파이, 크루아상	높은 층고와 편안한 소파 좌석에서 여유를 즐기는 로스터리 베이커리 카페	직접 로스팅하는 곳이라 그런지 커피 풍미가 정말 깊고 빵이랑 잘 어울려요|코르네파이의 바삭함과 크림의 조화가 훌륭해서 아이들도 너무 좋아합니다|층고가 높고 소파가 편안해서 가족 단위로 주말 아침에 브런치 먹기 최고예요	주택가 골목에 위치해 있어 매장 앞 주차가 매우 혼잡할 수 있습니다.	https://blog.naver.com/goodinhye|https://blog.naver.com/ssa8781/224271357375|https://blog.naver.com/adorable_sol_	웨이팅 없음	False	주차 불가 (대중교통 권장)	False	True	False	테라로사|로스터리 카페|테라로사가 대규모 기업형 로스터리 공장 느낌이라면, 로텐바우는 정감 가고 아늑한 동네 실력파 베이커리 로스터리	37.180645	127.1242273
카페,정순	경기 성남시 중원구 제일로35번길 37	성남 모란. 따뜻하고 정감 있는 분위기의 글루텐프리 쌀 디저트 전문점	쌀 케이크(갸또), 다쿠아즈	100% 국내산 쌀가루로 만들어 속이 편안하고 쫀득한 수제 갸또	밀가루를 못 먹는데 여기 쌀 케이크는 너무 쫀득하고 고소해서 자주 가요|단호박 쌀갸또랑 흑임자 갸또가 많이 달지 않아 부모님도 좋아하십니다|반려견 동반이 가능하고 사장님이 친절해서 언제나 기분 좋게 머물다 갑니다	매장이 골목에 위치해 주차가 어렵습니다.	https://blog.naver.com/2day__is/223983464426|https://blog.naver.com/bmc6a|https://blog.naver.com/swimoa	웨이팅 없음	False	주차 불가 (대중교통 권장)	False	False	True	설빙|건강 디저트|대형 프랜차이즈 디저트와 달리, 카페정순은 속이 편안한 100% 수제 쌀 디저트를 제공함	37.4314482	127.1327558
프랭크커핀바 동탄점	경기 화성시 동탄순환대로5길 19	동탄 호수공원. 어둡고 고풍스러운 유럽 감성의 에스프레소 바	오지크로플, 카페콘파나	묵직한 인테리어 속에서 즐기는 수준 높은 에스프레소와 바삭한 크로플	어두운 우드톤 인테리어에 포인트 조명이 있어서 대화에 집중하기 완벽해요|오지크로플 겉이 바삭하고 아이스크림이랑 조화가 끝내줍니다|에스프레소 메뉴가 다양하고 카페콘파나 크림이 정말 부드러워요	내부가 많이 어두운 편이라 밝은 곳을 선호하는 분들에게는 답답할 수 있습니다.	https://blog.naver.com/mki0921|https://blog.naver.com/blog_inn/223971630716|https://blog.naver.com/sin7u/224177922778	웨이팅 거의 없음	False	주차 정보 없음	False	False	False	스타벅스|분위기 및 감성|스타벅스가 밝고 대중적인 작업 공간이라면, 프랭크커핀바는 사색과 대화에 집중할 수 있는 어두운 유럽풍 감성	37.1664548	127.0995573
조앤도슨 연남본점	서울 마포구 동교로41길 31	연남동. 극악의 웨이팅을 뚫고 맛보는 겉바속촉 프렌치토스트의 정석	클래식 프렌치토스트	바삭한 겉면과 푸딩처럼 촉촉한 속, 말돈 소금이 더해진 완벽한 단짠	살면서 먹어본 프렌치토스트 중에 제일 맛있어요 웨이팅 한 보람이 있습니다|프렌치토스트에 말돈 소금을 살짝 찍어 먹으니 단짠단짠 미쳤습니다|밀크티도 진하고 목재 인테리어 특유의 아늑한 감성이 너무 좋아요	매장 내부가 좁아 효율적인 좌석 배치가 아니며 대기 시간이 매우 깁니다.	https://blog.naver.com/hellohi2-|https://blog.naver.com/binniq|https://blog.naver.com/tjdud272	캐치테이블/현장 웨이팅 긺	False	주차 정보 없음	False	False	False	카멜커피|프렌치토스트|카멜커피가 빈티지한 커피 맛집이라면, 조앤도슨은 독보적인 식감의 프렌치토스트에 특화된 연남동 핫플	37.5636521	126.9232497
버터맨션	경기 수원시 팔달구 화서문로 41	수원 행궁동. 영수증 사진기가 있는 꾸덕하고 쫀득한 버터바 전문점	버터바, 시그니처 버터라떼	층마다 다른 분위기를 즐길 수 있는 행궁동의 진득한 디저트 카페	버터바 종류가 진짜 다양하고 식감이 꾸덕쫀득해서 디저트 덕후 취향 저격입니다|매장에 영수증 사진기가 있어서 친구들이랑 추억 남기기 너무 좋았어요|버터라떼 위에 스카치 캔디 가루가 올라가서 달달하고 맛있습니다	간판이 작아서 처음 방문할 때 입구를 찾기 어려울 수 있습니다.	https://blog.naver.com/rmsdh44/223648340496|https://blog.naver.com/jun_ey-/223483226264|https://blog.naver.com/oustij204	주말 약간 대기	False	주차 정보 없음	False	False	False	노티드|꾸덕한 디저트|노티드가 푹신한 도넛의 대명사라면, 버터맨션은 버터 풍미 가득한 꾸덕쫀득 버터바 특화 공간	37.2853234	127.0125143
리프	경기 화성시 동탄순환대로14길 82-3	동탄. 싱그러운 식물과 온실 감성을 느낄 수 있는 플랜테리어 대형 공간	베이커리류, 아메리카노	탁 트인 층고와 푸릇푸릇한 식물들 사이에서 즐기는 도심 속 힐링	대형 온실처럼 꾸며져 있어서 날씨 안 좋은 날 가도 힐링 되는 기분이에요|식물이 많아서 부모님 모시고 가거나 아이들과 함께 가기 정말 좋습니다|빵 종류가 다양하고 큼직해서 식사 대용으로 먹기에도 부족함이 없어요	주말에는 아이 동반 가족 손님이 많아 다소 소란스러울 수 있습니다.	https://blog.naver.com/sweetablerim/223845861251|https://blog.naver.com/loxhh118/224260366915|https://blog.naver.com/sunny2117	웨이팅 없음	False	주차 정보 없음	False	True	False	마호가니|대형 플랜테리어|도심 속 일반 대형카페와 달리, 자연 속 식물원에 온 듯한 압도적인 플랜테리어 감성	37.1698991	127.1198035
뵈르	경기 화성시 동탄치동천로2길 4-18	동탄 치동천. 화학 첨가물 없이 매일 굽는 담백한 잠봉뵈르 맛집	잠봉뵈르 샌드위치, 스콘	좋은 재료로 정직하게 만든 바게트와 짭짤한 잠봉의 완벽한 밸런스	여기 잠봉뵈르는 바게트가 너무 딱딱하지 않고 고소해서 입천장 안 까져서 좋아요|치동천 산책하다가 들러서 브런치 먹기 딱 좋은 감성적인 분위기입니다|화학 계량제를 안 써서 그런지 빵을 많이 먹어도 속이 부대끼지 않아요	매장 앞 주차 공간이 협소하여 치동천 공영주차장을 이용해야 할 수 있습니다.	https://blog.naver.com/closingmoon/224244095350|https://blog.naver.com/unwi_21|https://blog.naver.com/yeowoolspace	포장 손님 많음	False	주차 가능 (공영/유료 주차장 등 확인 필요)	False	False	False	파리바게뜨|잠봉뵈르 샌드위치|일반 프랜차이즈 샌드위치와 달리, 뵈르는 신선한 재료와 무첨가 바게트로 만든 고품격 잠봉뵈르를 제공함	37.202664	127.1253856
