name	exactAddress	ambiance	signatureMenu	menuFeatures	positiveReviews	negativeReview	reviewLinks	waitingSystem	hasPlugs	parkingInfo	hasDecaf	isLargeCafe	isPetFriendly	comparisons	latitude	longitude
원스타임오프 성남점	경기 성남시 수정구 산성대로 63	성남 모란역. 8시간 냉침 밀크티와 우드톤 인테리어가 돋보이는 차분한 카공 성지	냉침 밀크티, 블렌딩 티	혼자 노트북 작업이나 독서하기 완벽한 정숙한 분위기와 퀄리티 높은 차	모란역 근처에서 이렇게 조용하고 차분하게 작업할 수 있는 카페가 있어서 너무 좋아요|밀크티가 엄청 진하고 향긋해서 갈 때마다 필수로 마십니다|1만원 이상 사면 주차 2시간 무료라 차 가져가기도 편해요	분위기가 스터디 카페 수준으로 너무 정숙해서 친구와 편하게 수다 떨기엔 눈치가 보입니다.	https://blog.naver.com/bibbiby/223896630379|https://blog.naver.com/leo2011|https://blog.naver.com/smilekang207	주말 오후 카공족으로 인해 만석	True	주차 가능 (공영/유료 주차장 등 확인 필요)	False	False	False	원스타임오프 평택점|카공 카페|같은 브랜드의 평택점과 마찬가지로 성남점 역시 밀크티의 깊은 맛과 독서실 같은 정숙한 분위기가 완벽하게 유지되는 작업 성지	37.4333948	127.1262709
아니버	부산 부산진구 서전로38번길 43-13	부산 전포. 화려한 비주얼로 시선을 사로잡는 샌드 베이글 핫플레이스	샌드 베이글	인스타그램 감성에 완벽히 부합하는 다채롭고 예쁜 속재료의 샌드 베이글	베이글 안에 재료가 진짜 터질 듯이 예쁘게 들어있어서 사진 찍을 맛이 납니다|다양한 맛의 샌드 베이글이 있어서 고르는 재미가 쏠쏠해요|전포동에서 비주얼 좋고 든든한 디저트 찾을 때 가기 좋습니다	시각적인 화려함에 비해 맛이 너무 달거나 자극적이어서 쉽게 물릴 수 있습니다.	https://blog.naver.com/ksbcce|https://blog.naver.com/hgkdud1004/224296346404|https://blog.naver.com/sec0/224062438835	주말 디저트 타임 웨이팅 발생	False	주차 정보 없음	False	False	False	런던베이글뮤지엄|베이글 핫플|안국 런던베이글뮤지엄이 영국 감성의 클래식한 쫄깃함을 자랑한다면, 전포 아니버는 화려하고 트렌디한 속재료로 꽉 채운 비주얼 샌드 베이글	35.1588868	129.0644641
아벡쉐리 롯데월드몰점	서울 송파구 올림픽로 300	잠실 롯데월드몰. 한남동에서 건너온 다채로운 라인업의 겉바속쫄 소금빵 전문점	소금빵, 소금빵 샌드위치	기본 소금빵부터 메론, 잠봉뵈르 등 다양한 변주를 갓 구워내는 베이커리	롯데월드몰 쇼핑하다가 맛있는 버터 냄새에 이끌려 샀는데 겉바속쫄의 정석입니다|기본 소금빵 말고도 콘소메, 메론크림 등 특이한 소금빵이 많아서 좋아요|따뜻하게 데워 먹으면 버터 풍미가 싹 올라와서 너무 맛있습니다	롯데월드몰 지하에 있어 매장이 개방되어 있고 늘 붐벼서 정신이 없습니다.	https://blog.naver.com/soon-1|https://blog.naver.com/dal831/224271083316|https://blog.naver.com/sia_mom2025	계속 구워내 회전율이 좋으나 줄서기 빈번	False	주차 불가 (대중교통 권장)	False	False	False	자연도 소금빵|소금빵 명가|성수 자연도 소금빵이 4개 세트로만 파는 버터 동굴의 끝판왕이라면, 아벡쉐리는 소금빵을 베이스로 한 다양하고 트렌디한 변주가 강점	37.5137012	127.1043763
송미방앗간	경기 성남시 중원구 광명로347번길 15	성남 단대오거리역. 국내산 쌀가루로 만드는 꾸덕한 할매입맛 글루텐프리 쌀디저트	흑임자 쌀케이크, 쑥 크럼블	밀가루를 전혀 쓰지 않아 속이 편안하고 흑임자, 인절미 등 고소한 맛의 극치	밀가루가 안 들어가서 많이 먹어도 더부룩하지 않고 속이 편안해서 좋아요|흑임자 쌀케이크가 진짜 꾸덕하고 꼬수워서 할매입맛인 제게 최고입니다|사장님이 정말 친절하시고 디저트 하나하나에 정성이 가득 담긴 게 느껴져요	쌀 디저트 특성상 일반 케이크보다 다소 무겁고 뻑뻑하게 느껴질 수 있습니다.	https://blog.naver.com/goodch03|https://blog.naver.com/namalog|https://blog.naver.com/ol_th/224272445420	포장 위주라 웨이팅 적음	False	주차 정보 없음	False	False	False	소소하게|쌀케이크 전문점|성수 소소하게가 푹신한 백설기 같은 질감의 쌀케이크라면, 성남 송미방앗간은 꾸덕하고 치덕한 텍스처에 할매입맛 재료를 듬뿍 넣은 묵직한 쌀케이크	37.4482712	127.1578198
크리미	부산 부산진구 서전로38번길 43-13	부산 전포동. 폭발하는 크림 비주얼로 빵지순례 필수 코스가 된 디저트샵	쿠키슈, 뽀또 푸딩, 모찌뿌요	황치즈 등 다양한 크림이 가득 찬 푸딩과 쫄깃한 모찌뿌요의 압도적 달콤함	황치즈 뽀또 푸딩은 단짠단짠의 정석이고 안에 든 크럼블 식감이 미쳤어요|모찌뿌요 빵 피가 진짜 이름처럼 쫀득하고 안에 크림이 터질 듯이 많습니다|전포동 오면 무조건 웨이팅해서라도 포장해가는 크림 맛집이에요	인기가 너무 많아 늦게 가면 다 팔리고 없고, 맛이 상당히 달아서 호불호가 갈릴 수 있습니다.	https://blog.naver.com/alsoof/224253042002|https://blog.naver.com/moonmina91/224303423685|https://blog.naver.com/y_vvd/224187305973	오픈런 필수 및 상시 웨이팅	False	주차 정보 없음	False	False	False	코코로카라|크림 푸딩|연남동 코코로카라가 보틀 케이크와 바나나 푸딩의 대명사라면, 전포 크리미는 푸딩뿐 아니라 쿠키슈와 모찌뿌요까지 아우르는 크림 디저트계의 신흥 강자	35.1570674	129.0647671
해피메모리 동탄목동점	경기 화성시 왕배산3길 4	… 해피메모리는 동탄2신도시 주택가 골목에 있는 작은 카페라 번잡한 메인 거리랑은 완전히 다른 분위기예요	정보 없음	특징 정보 없음	리뷰 정보 없음	부정적 리뷰 없음	https://young0316.tistory.com/254|https://pandarank.net/contents/6981983bfa0a7102d4b4505c|https://conyplace.com/해피메모리-동탄목동점-동탄의-아늑한-브런치-카페/	정보 없음	False	인근 공영주차장 이용	False	True	False	일반 카페|분위기|… 해피메모리는 동탄2신도시 주택가 ...	37.181329	127.1255063
롱드메이	경기 용인시 수지구 만현로 110	용인 수지. 디저트 애호가들을 위한 핫플레이스	두바이 쫀득쿠키	카다이프의 바삭함과 피스타치오의 풍미를 한국식으로 해석한 두바이 쫀득쿠키	두바이 쫀득쿠키의 겉바속쫀 식감이 미쳤어요|줄 서서 먹을 만한 가치가 있는 디저트입니다|휘낭시에나 에그타르트 같은 다른 구움과자도 수준급이에요	웨이팅이 너무 길고 건물 지하 주차장이 매우 혼잡합니다.		오픈 전부터 상시 오픈런 및 웨이팅 발생	False	주차 가능 (공영/유료 주차장 등 확인 필요)	False	False	False	이웃집통통이|트렌디 디저트|이웃집통통이가 압구정에서 약과 쿠키 트렌드를 이끈다면, 용인 롱드메이는 두바이 쫀득쿠키 열풍의 중심지	37.3068743	127.084495
지지엔엔 베이크 샵	서울 동작구 만양로8길 50	노량진 우성아파트 상가. 매주 라인업이 바뀌는 트렌디한 테이크아웃 전문 구움과자샵	두바이 쫀득쿠키, 보틀케이크	크림 푸딩, 버터떡 등 다채롭고 개성 있는 라인업의 디저트	디저트 라인업이 자주 바뀌어서 매번 갈 때마다 새로운 맛을 즐길 수 있어요|두바이 쫀득쿠키랑 크림 푸딩이 정말 맛있습니다|노량진에 이런 고퀄리티 디저트 샵이 있어서 행복해요	테이크아웃 전용 매장이라 먹고 갈 공간이 없고 가격대가 조금 높습니다.	https://blog.naver.com/sbm0409/223938506801|https://blog.naver.com/sbm0409|https://blog.naver.com/ninjagb2/224153383715	예약 가능, 현장 웨이팅 약간	False	주차 정보 없음	False	False	False	크리미|크림 디저트|전포 크리미가 쿠키슈와 모찌뿌요 중심이라면, 노량진 지지엔엔은 트렌드를 가장 빠르게 반영하는 다양한 라인업의 테이크아웃 디저트	37.5102417	126.9465559
하프베이글	서울 마포구 성미산로17길 115	연남동 인근 성산동. 질깃하고 쫄깃한 식감을 살린 테이크아웃 샌드베이글 전문점	피스타치오 딸기 샌드베이글	생과일과 크림치즈가 듬뿍 들어간 화려한 비주얼의 샌드베이글	베이글이 질깃하고 쫄깃해서 제가 딱 좋아하는 식감이에요|피스타치오 딸기 샌드베이글은 크림치즈와 과일이 듬뿍 들어가서 가성비 최고입니다|연남동 빵지순례 할 때 웨이팅 없이 편하게 살 수 있어서 좋아요	매장 내부가 협소하여 홀 식사가 불가능한 포장 전문점입니다.	https://blog.naver.com/silklombar|https://blog.naver.com/nanviolet77|https://blog.naver.com/akm5701/223938751402	웨이팅이 적어 쾌적함	False	주차 정보 없음	False	False	False	코끼리베이글|쫄깃한 베이글|코끼리베이글이 화덕에 구운 쫀득한 기본 베이글의 강자라면, 하프베이글은 생과일과 크림치즈를 터질 듯 넣은 샌드베이글	37.5665505	126.9169432
히포파운드	전북 전주시 완산구 기린대로 130	전주. 제주도 빵지순례 명소에서 전주로 이전한 쫄깃한 베이글 크림 샌드 맛집	우유크림 믹스후르츠 베이글	겉은 바삭하고 속은 쫄깃한 베이글 사이에 신선한 과일과 꾸덕한 크림을 아낌없이 샌딩	베이글 안에 과일이 꽉 차 있고 크림이 느끼하지 않아 식사 대용으로도 완벽해요|제주도에서 먹던 그 감동적인 맛 그대로 전주에서 먹을 수 있어서 좋습니다|사장님이 너무 친절하셔서 웨이팅이 아깝지 않아요	일주일에 금, 토, 일요일만 영업해서 방문 일정을 맞추기가 까다롭습니다.	https://blog.naver.com/qorjfmeo/224104807266|https://blog.naver.com/orang2in/224297115054|https://blog.naver.com/llvovll1023	오픈 전부터 대기, 테이블링 웨이팅 필수	False	주차 정보 없음	False	False	False	포비|베이글 샌드|광화문 포비가 담백한 베이글과 다양한 크림치즈 스프레드의 조합이라면, 전주 히포파운드는 터질 듯한 크림과 과일이 메인인 디저트 베이글 샌드	35.8205627	127.1534283
카페여기 성남점	경기 성남시 중원구 둔촌대로101번길 16-19	성남. 가볍게 커피를 즐길 수 있는 동네 카페	아메리카노	부담 없이 방문하기 좋은 편안한 분위기의 동네 휴식처	동네에 있어서 오가며 커피 한 잔 마시기 편안합니다|가격이 합리적이고 조용한 분위기라 잠시 쉬어가기 좋아요|사장님이 친절하게 응대해 주십니다	온라인 상에 구체적인 리뷰나 시그니처 메뉴 정보가 거의 없습니다.	https://blog.naver.com/sosam_|https://blog.naver.com/ng312/224300450195|https://blog.naver.com/dodammom22	웨이팅 없음	False	주차 불가 (대중교통 권장)	False	False	False	카페 바솔트|동네 카페|동탄 바솔트가 크림라떼와 인스타 감성이라면, 카페여기 성남점은 소박하고 일상적인 동네 쉼터	37.4312702	127.13122
레이지오븐	경기 화성시 동탄치동천로3길 30	동탄 영천동. 유럽 빈티지 감성이 물씬 풍기는 통통한 베이글 맛집	통통 베이글, 두바이 쫀득쿠키	조용하고 아늑한 공간에서 직접 구워내는 쫄깃한 베이글과 트렌디한 구움과자	베이글이 엄청 통통하고 쫄깃해서 정말 맛있습니다|유럽 빈티지 감성 인테리어라 사진 찍기도 좋고 대화 나누기도 좋아요|포장해서 가까운 동탄호수공원으로 피크닉 가기 완벽합니다	주차 공간이 마련되어 있으나 다소 협소합니다.	https://blog.naver.com/celina_827|https://blog.naver.com/love110407ing/224162935730|https://blog.naver.com/celina_827/224276747957	웨이팅 없음	False	주차 가능 (공영/유료 주차장 등 확인 필요)	False	False	False	런던베이글뮤지엄|유럽 감성 베이글|안국 런던베이글뮤지엄이 영국풍 인테리어와 화려한 라인업이라면, 동탄 레이지오븐은 여유로운 빈티지 감성과 기본에 충실한 통통한 베이글	37.2029769	127.1224835
스쿠퍼젤라또 삼각지점	서울 용산구 한강대로62길 37	용리단길 삼각지. 서촌 본점의 명성을 잇는 이탈리아 정통 젤라떼리아	리조(쌀), 피스타치오 젤라또	이탈리아 정부 인증을 받은 쫀득한 식감과 원재료의 맛을 극대화한 다양한 라인업	리조(쌀) 젤라또는 쌀알이 쫀득하게 씹히고 피스타치오는 원물 맛이 엄청 진해요|용리단길에서 밥 먹고 후식으로 먹기 딱 좋은 상큼한 맛입니다|맛보기 스푼 서비스가 있어서 다른 맛도 한 입 먹어볼 수 있는 게 큰 장점이에요	매장 내부가 매우 아담하여 먹고 갈 자리가 거의 없고 전용 주차장이 없습니다.	https://blog.naver.com/pooding_21/224297244553|https://blog.naver.com/psy-wave|https://blog.naver.com/jir1210/224293046017	테이크아웃 손님 많으나 회전율 빠름	False	주차 불가 (대중교통 권장)	False	False	False	당도|젤라또 전문점|망원동 당도가 아기자기한 과일 소르베 위주의 귀여운 젤라또라면, 삼각지 스쿠퍼는 이탈리아 정통의 쫀득함과 원물의 깊은 풍미	37.5332645	126.9736894
스푼업	서울 용산구 한강대로46길 16	용리단길. 조용하게 쉬어가기 좋은 아늑한 휴식 공간	아메리카노, 디저트	용리단길 골목에 숨겨진 차분하고 여유로운 카페	식사 후 조용하게 대화 나누기 좋은 편안한 카페입니다|커피 맛이 무난하고 인테리어가 깔끔해요|복잡한 용리단길 메인 거리에서 조금 벗어나 있어 여유롭습니다	구체적인 시그니처 메뉴에 대한 온라인 리뷰가 매우 부족합니다.	https://blog.naver.com/wud42424|https://blog.naver.com/hedgehog_21|https://blog.naver.com/myqueen37	웨이팅 없음	False	주차 정보 없음	False	False	False	도토리 가든|용리단길 카페|안국 도토리가든이 지브리 감성의 확고한 컨셉과 웨이팅을 자랑한다면, 용리단길 스푼업은 조용하고 편안한 쉼터	37.5310833	126.9710259
카페레이들	경기 화성시 동탄순환대로5길 13	동탄 호수공원 인근. 새롭게 오픈한 깔끔한 감성 브런치 카페	브런치, 커피	채광이 좋고 여유로운 분위기에서 즐기는 캐주얼한 브런치	새로 생겨서 매장이 정말 깔끔하고 인테리어가 쾌적합니다|동탄 호수공원 산책하고 들러서 브런치 먹기 좋은 위치예요|햇살이 잘 들어와서 주말 아침에 여유 부리기 딱입니다	신상 카페라 아직 다양한 메뉴에 대한 구체적인 후기가 부족합니다.	https://blog.naver.com/third_run|https://blog.naver.com/freeman0604/224187480186|https://blog.naver.com/hahehihohu_77	웨이팅 없음	False	주차 정보 없음	False	False	False	베이크오이|브런치 카페|대구 베이크오이가 소품샵 뷰와 화려한 샌드위치 라인업이라면, 동탄 카페레이들은 호수공원 인근의 여유로운 신상 브런치 공간	37.1659539	127.0996616
The november 라운지 동탄점	경기 화성시 동탄기흥로 593-37	동탄. 넓은 공간과 편안한 소파를 갖춘 새벽까지 운영하는 대형 카페	아메리카노, 디저트	카공족에게 사랑받는 조용한 분위기와 시간 구애 없이 방문할 수 있는 아지트	동탄에서 늦은 새벽까지 눈치 안 보고 카공하거나 작업하기 가장 좋은 카페입니다|소파 좌석이 너무 편안해서 오래 앉아 있어도 피로하지 않아요|매장이 넓고 좌석 간격이 넓어서 친구들과 대화하기도 좋습니다	규모가 크다 보니 피크 타임에는 전용 주차장이 혼잡할 때가 있습니다.	https://blog.naver.com/0821hyun/224174372219|https://blog.naver.com/2unbiii/223898015740|https://blog.naver.com/maelog_	새벽까지 여유롭게 이용 가능	True	주차 가능 (공영/유료 주차장 등 확인 필요)	False	True	False	원스타임오프 성남점|작업하기 좋은 카페|모란 원스타임오프가 밀크티와 정숙한 독서실 감성이라면, 동탄 노벰버라운지는 푹신한 소파와 넓은 공간의 여유로운 새벽 작업 아지트	37.2121422	127.0921408
픽베이크 오산점	경기 오산시 대호로 97	오산 궐동. 바삭한 식감의 에그타르트 전문 구움과자점	에그타르트	버터 풍미가 짙은 페이스트리에 부드러운 커스터드 필링을 채운 겉바속촉 에그타르트	페이스트리 결이 살아있어서 정말 바삭하고 커스터드 필링은 입에서 녹아요|오산에서 먹은 에그타르트 중에 단연 최고입니다|포장 패키지가 깔끔해서 선물용으로 구매하기 너무 좋아요	매장 내부 취식 공간이 협소합니다.	https://blog.naver.com/hogain|https://blog.naver.com/ehehaka11/224255817903|https://blog.naver.com/jjjjjj0007	포장 위주, 대기 적음	False	주차 정보 없음	False	False	False	나타오비카|에그타르트|나타오비카가 전국구 포르투갈식 타르트라면, 픽베이크는 오산 로컬의 바삭한 에그타르트 맛집	37.1589965	127.0539717
유밀정 케이커리	경기 화성시 동탄순환대로3길 28-10	동탄 호수공원 택지지구. 직접 농사지은 작물로 만든 수제 케이크 전문점	수제 케이크	직접 재배한 건강한 농작물을 활용해 많이 달지 않고 정성이 가득 들어간 디저트	케이크가 자극적이지 않고 달지 않아서 어른들 모시고 오기 좋아요|통창으로 보이는 동탄 호수공원 뷰가 아주 시원합니다|농사지은 재료로 만들어서 그런지 더 건강하게 느껴집니다	주말 낮에는 창가 자리를 잡기가 쉽지 않습니다.	https://blog.naver.com/pppeace33/224124531525|https://blog.naver.com/woningmom/224280827204|https://blog.naver.com/dasli1216/223997031717	웨이팅 없음	False	주차 정보 없음	False	False	False	도레도레|수제 케이크|도레도레가 화려한 비주얼의 무지개 케이크라면, 유밀정 케이커리는 농작물을 활용한 소박하고 건강한 뷰 맛집 케이크	37.1671865	127.095615
카페홀로	경기 화성시 왕배산3길 28	동탄. 동네 주민들의 아늑하고 편안한 단골 카페	커피, 쿠키	조용한 주택가에서 편안하게 커피 한 잔과 가벼운 쿠키를 곁들이기 좋은 메뉴 구성	사장님이 정말 친절하시고 커피 가격도 부담스럽지 않아요|조용해서 혼자 책 읽거나 멍 때리기 가장 좋은 동네 아지트입니다|매장이 깔끔하고 아늑한 분위기라 자주 방문합니다	메뉴에 대한 구체적인 리뷰나 시그니처 디저트에 대한 정보가 부족합니다.	https://blog.naver.com/w130312/223981729114|https://blog.naver.com/w130312|https://blog.naver.com/jsy6768/224233923806	웨이팅 없음	False	주차 정보 없음	False	False	False	스타벅스|동네 카페|스타벅스가 일률적이고 붐비는 대형 프랜차이즈라면, 카페홀로는 주택가의 따뜻하고 조용한 동네 쉼터	37.1812173	127.1260623
스트레스드	경기 화성시 왕배산1길 3-12	동탄. 달지 않고 부드러운 수제 케이크로 피로를 녹여주는 디저트 샵	수제 케이크	과도한 단맛을 줄이고 크림의 부드러움을 극대화한 부담 없는 케이크 라인업	크림이 느끼하지 않고 정말 부드러워요|단맛이 강하지 않아서 케이크 한 조각을 다 먹어도 속이 편안합니다|이름처럼 스트레스 받을 때 여기 케이크 먹으면 힐링돼요	매장이 아담하여 피크 시간대에는 여유롭게 먹고 가기 어려울 수 있습니다.	https://blog.naver.com/sy901204|https://blog.naver.com/hanni_0|https://blog.naver.com/moodmuk/223915759618	웨이팅 없음	False	주차 정보 없음	False	False	False	빌리엔젤|수제 케이크|빌리엔젤이 진하고 화려한 미국식 케이크라면, 스트레스드는 은은하고 부드러운 힐링용 감성 케이크	37.1807702	127.1240069
치즈당 동탄카림센텀점	경기 화성시 동탄대로시범길 142	동탄 카림애비뉴. 촉촉하고 퐁신한 대왕 카스테라 전문점	대왕 카스테라	부드럽고 폭신한 식감에 생크림, 치즈 등을 더해 남녀노소 즐기기 좋은 카스테라	카스테라가 퍽퍽하지 않고 정말 구름처럼 폭신해요|생크림 카스테라는 크림이 듬뿍 들어있어서 우유랑 먹으면 환상적입니다|양이 많아서 가족들이랑 나눠 먹기 딱 좋습니다	포장 전문이라 매장 내부에서 취식할 공간이 없습니다.	https://blog.naver.com/friendgirl88|https://blog.naver.com/ziehyunk|https://blog.naver.com/eng_jade/224265757060	테이크아웃 위주라 회전율 빠름	False	주차 불가 (대중교통 권장)	False	False	False	대만언니대왕카스테라|대왕 카스테라|대만언니가 오리지널 대왕 카스테라의 시초라면, 치즈당은 다양한 크림과 치즈를 더해 트렌디하게 업그레이드함	37.1999195	127.1133874
비지터	서울 종로구 옥인길 32-3	서촌 옥인길. 커피와 주류를 아우르는 미국 감성의 분위기 좋은 바 겸 카페	포카치아 샌드위치, 소르베	조도를 낮춘 감각적인 공간에서 즐기는 상큼한 소르베와 와인에 어울리는 샌드위치	조명이 어둡고 분위기가 너무 좋아서 데이트나 소개팅 장소로 완벽해요|상큼한 소르베가 식후 디저트로 최고입니다|경복궁역에서 멀지만 그만큼 한적하고 나만 알고 싶은 아지트 느낌이에요	경복궁역에서 도보 15분 정도로 거리가 꽤 멀고 오르막입니다.	https://blog.naver.com/toodesigner|https://blog.naver.com/sbsb0125/223705894245|https://blog.naver.com/bborongrongg/224056801953	주말 저녁 현장 웨이팅	False	주차 정보 없음	False	False	False	바 참|서촌 카페 앤 바|바 참이 전문적인 칵테일 바라면, 비지터는 낮에는 커피와 샌드위치, 밤에는 가벼운 와인을 즐기는 캐주얼한 공간	37.5810753	126.9669065
유월커피 역삼	서울 강남구 봉은사로30길 76	역삼 오피스 빌딩 숲. 부산 전포동 감성을 그대로 옮겨온 직장인들의 커피 성지	유월커피(더티커피)	부드러운 크림이 흘러내리는 시그니처 더티커피와 따뜻한 분위기	시그니처 유월커피의 크림이 정말 달콤하고 부드러워요|역삼 빌딩 숲 사이에 이런 따뜻한 감성의 카페가 있어서 너무 좋습니다|제휴 할인이 돼서 직장인들이 식후에 방문하기 아주 훌륭합니다	평일 점심시간에는 직장인들로 매우 붐벼서 여유롭게 앉아있기 힘듭니다.	https://blog.naver.com/mamstable|https://blog.naver.com/malang-315/224054146757|https://blog.naver.com/dear_1108	점심시간 주문 대기 길음	False	주차 정보 없음	False	False	False	블루보틀|오피스상권 카페|블루보틀이 미니멀하고 세련된 스페셜티 브랜드라면, 유월커피는 부산 감성의 따뜻함이 묻어나는 크림 커피 맛집	37.5026457	127.03693
오르또커피하우스	경기 화성시 동탄기흥로520번나길 3-3	동탄. 톤 다운된 레드 컬러 인테리어가 인상적인 감성 카페	Orto 피넛크림 라떼, 시즌 과일 디저트	묵직하고 고소한 피넛 크림이 올라간 시그니처 라떼와 정성스러운 시즈널 케이크	피넛크림 라떼가 고소하고 달달해서 계속 생각나는 맛이에요|인테리어가 감각적이고 레드 포인트가 예뻐서 사진 찍기 좋습니다|계절마다 바뀌는 시즈널 디저트 퀄리티가 훌륭해요	의자가 다소 불편해서 오래 앉아있기에는 적합하지 않습니다.	https://blog.naver.com/wkdduswn1452|https://blog.naver.com/limspec|https://blog.naver.com/nenelicious	주말 오후 약간의 웨이팅	False	주차 정보 없음	False	False	False	테일러커피|크림 커피|테일러커피가 연남동 크림모카의 정석이라면, 오르또커피하우스는 동탄의 감성 인테리어와 묵직한 피넛크림 라떼	37.2069502	127.0938108
